<?xml version="1.0" encoding="ISO-8859-1" ?>
<revista xmlns:xsi="http://www.w3.org/2001/XMLSchema-instance"
xsi:noNamespaceSchemaLocation="revistas.xsd" codigo="0123456789">
	<nombre>El semanal</nombre>
	<fechasalida>2011-02-13</fechasalida>
	<articulo>
			<titulo>Caida de Mubarak</titulo>
			<autor>Pedro Jiménez</autor>
			<numeropalabras>70</numeropalabras>
			<texto>Egipto se ha echado a la calle ante la noticia de que ...bla, bla, bla</texto>
	</articulo>
</revista>
